{
  "schema_version": "oagrc-contribution-0.1",
  "artifact_id": "OAGRC-2026-08-06-CHATGPT-REVIEW-ROUND-03-001",
  "artifact_type": "contribution",
  "round": "review-round-03",
  "raw": {
    "path": "corpus/raw/review-round-03/chatgpt-01.md",
    "sha256": "bca15d13272bf7f27a10e52af08db064107404a8c732d0d45f9b9297adef7fc0",
    "bytes": 16559
  },
  "prompt": {
    "path": "record/review-round-03-prompt.md",
    "sha256": "39fced21b0ba07a3299bcd08d8008c407725bf58c8c60425e7b8a9222b084473",
    "bytes": 9297
  },
  "contributor": {
    "identity": "ChatGPT",
    "provider": "OpenAI",
    "version_identifier": null,
    "version_unknown_reason": "Chat surface does not expose a version identifier.",
    "reasoning_effort": null,
    "reasoning_effort_unknown_reason": "Not selectable or not reported by the chat surface.",
    "system_instructions": null,
    "system_instructions_unknown_reason": "Provider system prompt not disclosed.",
    "sampling_parameters": null,
    "sampling_unknown_reason": "Chat surface does not expose sampling parameters.",
    "tools_used": [],
    "prior_context": "Reviewer reads the live repository directly."
  },
  "captured_utc": "2026-08-06T18:48:47Z",
  "capture_method": "Pasted from the provider surface into the local capture UI by the custodian, hashed at paste time, ingested from the resulting bundle. No intermediary transcription.",
  "phase": "Phase-2 (informed)",
  "edit_status": "unedited",
  "k": 1,
  "sample_index": 1,
  "variance_reported": false,
  "variance": null,
  "citability": "citable_artifact",
  "distributional_inference": "insufficient_k",
  "attribution_status": "active",
  "captured_by": "Stephen Reed"
}
