{
  "schema_version": "oagrc-contribution-0.1",
  "artifact_id": "OAGRC-2026-08-05-GEMINI-REVIEW-ROUND-02-PROMPT-CRITIQUE-001",
  "artifact_type": "contribution",
  "round": "review-round-02-prompt-critique",
  "raw": {
    "path": "corpus/raw/review-round-02-prompt-critique/gemini-01.md",
    "sha256": "e2dc55767ea9b51bab8f8ea6199ba98beb3c4cb90dc88dbe0949ce92a6364915",
    "bytes": 4141
  },
  "prompt": {
    "path": "record/review-round-02-prompt.md",
    "sha256": "9cce733384ee36aab1416cae949ae08f9a97e699575ce5bf6ef14e2401c35149",
    "bytes": 7193
  },
  "contributor": {
    "identity": "Gemini",
    "provider": "Google DeepMind",
    "version_identifier": null,
    "version_unknown_reason": "Chat surface does not expose a version identifier.",
    "reasoning_effort": null,
    "reasoning_effort_unknown_reason": "Not selectable or not reported by the chat surface.",
    "system_instructions": null,
    "system_instructions_unknown_reason": "Provider system prompt not disclosed.",
    "sampling_parameters": null,
    "sampling_unknown_reason": "Chat surface does not expose sampling parameters.",
    "tools_used": [],
    "prior_context": "Given the review-round-02 prompt as a DRAFT to critique, not as a review request."
  },
  "captured_utc": "2026-08-05T15:29:01Z",
  "capture_method": "Saved verbatim from the provider chat surface to a file by the custodian, then captured from that file; no intermediary transcription.",
  "phase": "Phase-2 (informed)",
  "edit_status": "unedited",
  "k": 1,
  "sample_index": 1,
  "variance_reported": false,
  "variance": null,
  "citability": "citable_artifact",
  "attribution_status": "active",
  "captured_by": "Stephen Reed (human custodian)",
  "notes": "NOT a review-round-02 review. This artifact critiques the round-02 PROMPT and recommends refinements before dispatch. Filed under a separate round label so it is never counted as one of the four round-02 reviews. Gemini's round-02 review has not been collected.",
  "distributional_inference": "insufficient_k",
  "citability_migration_note": "Migrated from the superseded single field value 'non-citable (k=1)' on 2026-08-05. That value conflated 'not evidence of a stable position' with 'not evidence of anything'. A single sample IS citable as an artifact of one identified invocation. Corrected per ChatGPT, review round 02 (D-07)."
}
